{
  "id": "clean-method-stays-quiet",
  "split": "tuning",
  "provenance": {
    "origin": "synthetic",
    "license": "generated in this repository; contains no third-party code",
    "revision": null,
    "note": "Written by hand for this corpus, not sampled from a real codebase."
  },
  "repository": {
    "files": [
      "src/main/java/app/Calculator.java"
    ]
  },
  "changes": [
    {
      "path": "src/main/java/app/Calculator.java",
      "edit": "replace",
      "content": "package app;\npublic class Calculator {\n    public int add(int left, int right) {\n        return left + right;\n    }\n}\n"
    }
  ]
}
